{
  "id": "opencode",
  "bin": "opencode",
  "pin_tmpdir": true,
  "env": {
    "TMPDIR": "{workdir}",
    "TMP": "{workdir}",
    "TEMP": "{workdir}"
  },
  "current_dir_workdir": true,
  "extra_args_env": "OPENCODE_ARGS",
  "provision": { "skills": { "dir": "{workdir}/.opencode/skills" } },
  "execute": {
    "args": [
      "run",
      "--auto",
      "{extra_args}",
      "{prompt}"
    ]
  },
  "result": { "kind": "stdout" }
}
