{
  "id": "goose-isolated",
  "bin": "goose",
  "pin_tmpdir": true,
  "env": {
    "TMPDIR": "{workdir}",
    "TMP": "{workdir}",
    "TEMP": "{workdir}"
  },
  "current_dir_workdir": true,
  "system_flag": "--system",
  "extra_args_env": "GOOSE_ARGS",
  "env_flags": [
    { "flag": "--provider", "env": "GOOSE_PROVIDER" },
    { "flag": "--model", "env": "GOOSE_MODEL" }
  ],
  "pass_env_prefixes": ["GOOSE_", "OPENAI_"],
  "pass_env_suffixes": ["_API_KEY"],
  "stdin_null": true,
  "isolation": {
    "env": {
      "HOME": "{config_root}",
      "XDG_CONFIG_HOME": "{config_root}/.config",
      "XDG_DATA_HOME": "{config_root}/.local/share",
      "XDG_STATE_HOME": "{config_root}/.local/state",
      "XDG_CACHE_HOME": "{config_root}/.cache"
    }
  },
  "provision": { "skills": { "dir": "{config_root}/.config/goose/skills" } },
  "execute": {
    "args": [
      "run",
      "--text",
      "{prompt}",
      "--no-session",
      "--quiet",
      "{env_flags}",
      "{system}",
      "{extra_args}"
    ]
  },
  "result": { "kind": "stdout" }
}
